{
  "$schema": "https://json-schema.org/draft-07/schema#",
  "$id": "https://gitmap.dev/schemas/version-history.schema.json",
  "title": "gitmap version-history --json",
  "description": "Machine-readable shape emitted by `gitmap version-history --json`. Top-level is an array of version transition records, each capturing a flatten/unflatten or re-tag event for a tracked repository. Field order is contractual: fromVersionTag, fromVersionNum, toVersionTag, toVersionNum, flattenedPath?, createdAt?, id, repoId.",
  "type": "array",
  "items": {
    "type": "object",
    "required": [
      "fromVersionTag",
      "fromVersionNum",
      "toVersionTag",
      "toVersionNum",
      "id",
      "repoId"
    ],
    "properties": {
      "fromVersionTag": {
        "type": "string",
        "description": "Source version tag before the transition (e.g. 'v5.40.0')."
      },
      "fromVersionNum": {
        "type": "integer",
        "description": "Numeric component of the source version (e.g. 50400 for v5.40.0)."
      },
      "toVersionTag": {
        "type": "string",
        "description": "Destination version tag after the transition (e.g. 'v5.41.0')."
      },
      "toVersionNum": {
        "type": "integer",
        "description": "Numeric component of the destination version (e.g. 50410 for v5.41.0)."
      },
      "flattenedPath": {
        "type": "string",
        "description": "Absolute path of the repo after flattening. Omitted when empty."
      },
      "createdAt": {
        "type": "string",
        "description": "ISO-8601 timestamp when the transition was recorded. Omitted when empty."
      },
      "id": {
        "type": "integer",
        "description": "Primary key of the version-history row."
      },
      "repoId": {
        "type": "integer",
        "description": "Foreign key referencing the repo this transition belongs to."
      }
    }
  }
}
